{
  "$schema": "./_schema.json",
  "id": "waves-1",
  "name": {
    "zh": "鸣潮·黑青",
    "en": "Waves Dark Teal"
  },
  "order": 120,
  "appearance": "dark",
  "chrome": "neon",
  "seeds": {
    "accent": "#3fd6d0",
    "secondary": "#9aa8b0",
    "surface": "#0d1418",
    "text": "#d8eef0"
  },
  "hero": "waves-1-bg.webp",
  "heroFocus": "50% 30%",
  "glyph": "🌊"
}
