{
  "$schema": "./_schema.json",
  "id": "deepspace-light",
  "name": {
    "zh": "恋与深空·星海",
    "en": "Love&Deepspace Starry"
  },
  "order": 80,
  "appearance": "light",
  "chrome": "glass",
  "seeds": {
    "accent": "#8f7fe8",
    "secondary": "#f097c8",
    "surface": "#f6f2fb",
    "text": "#4a4668"
  },
  "hero": "deepspace-light-bg.webp",
  "heroFocus": "50% 8%",
  "glyph": "🌌"
}
